{
  "schema_version": 1,
  "source_identity": "e493dfb724934ad6eb7c833518803f56cc9ffcaa1fc63d23b9d5e9200e818e25",
  "units": {
    "greeting": [
      "Is name_len bounded before any name byte is read?",
      "Is every write to out bounded by capacity, and can the size arithmetic wrap?",
      "Do all failure paths leave out[0] NUL when capacity > 0 and *written 0?"
    ],
    "greeting_text": [
      "Does UTF-8 validation reject invalid lead bytes, truncated, bad-continuation, overlong, surrogate and above-U+10FFFF sequences while staying within length?",
      "Does the printable check reject C0 controls, DEL and C1 controls, and does invalid UTF-8 win over a control?"
    ],
    "greeting_main": [
      "Does greeting_main bound the argument scan, handle a NULL name and report usage, status and write errors?"
    ]
  },
  "findings": [
    {
      "id": "GREETING-0001",
      "origin": "reviewer:example-walkthrough",
      "source_identity": "e493dfb724934ad6eb7c833518803f56cc9ffcaa1fc63d23b9d5e9200e818e25",
      "location": "src/greeting.c:23",
      "property": "out-of-bounds read of name when name_len exceeds the readable name buffer (for example SIZE_MAX)",
      "severity": "high if real: read past a borrowed caller buffer",
      "rationale": "Illustrative example entry for the hello-world example, not a record of a real external review. A caller can pass a name_len larger than the readable name bytes; the UTF-8 scan would then read past the buffer. Each review unit names a source file, src/<unit>.c, and its locations are line numbers in that file. source_identity is the sha256 of json.dumps({path: sha256}, sort_keys=True) over the example files under src/, include/, tests/project/, fuzz/project/, specs/project/ and review/ (paths relative to examples/hello-world, review/ledger.json excluded).",
      "reproducer": "tests/project/test_greeting.c format_cases rows {.name = max_name, .len = 65U, .cap = 128U, .want = GREETING_NAME_TOO_LONG} and {.name = max_name, .len = SIZE_MAX, .cap = 128U, .want = GREETING_NAME_TOO_LONG}",
      "state": "REJECTED",
      "attempts": 0,
      "history": [
        {
          "reason": "Not a defect: validate() rejects name_len > GREETING_NAME_MAX at src/greeting.c:23 before greeting_check_text() reads any byte; the SIZE_MAX and 65-byte boundary tests cover it and the fuzz target checks it for every input length.",
          "duplicate_of": null
        }
      ],
      "verification": null
    }
  ],
  "review": [
    {
      "unit": "greeting",
      "question": "Is name_len bounded before any name byte is read?",
      "locations": [
        23,
        26
      ]
    },
    {
      "unit": "greeting",
      "question": "Is every write to out bounded by capacity, and can the size arithmetic wrap?",
      "locations": [
        31,
        49,
        50,
        53,
        59,
        61
      ]
    },
    {
      "unit": "greeting",
      "question": "Do all failure paths leave out[0] NUL when capacity > 0 and *written 0?",
      "locations": [
        9,
        39,
        40,
        45
      ]
    },
    {
      "unit": "greeting_text",
      "question": "Does UTF-8 validation reject invalid lead bytes, truncated, bad-continuation, overlong, surrogate and above-U+10FFFF sequences while staying within length?",
      "locations": [
        14,
        15,
        23,
        26,
        32,
        35,
        44,
        47,
        57,
        73,
        74,
        77,
        78,
        88
      ]
    },
    {
      "unit": "greeting_text",
      "question": "Does the printable check reject C0 controls, DEL and C1 controls, and does invalid UTF-8 win over a control?",
      "locations": [
        102,
        105,
        121,
        124
      ]
    },
    {
      "unit": "greeting_main",
      "question": "Does greeting_main bound the argument scan, handle a NULL name and report usage, status and write errors?",
      "locations": [
        12,
        15,
        27,
        31,
        36,
        39,
        40,
        41,
        42,
        44
      ]
    }
  ]
}
